{
  "version": "0.1.0",
  "kind": "praxis.semantic-grounding.generative-ui-corpus",
  "description": "Initial acceptance corpus for progressive machine-first domain grounding and evidence-backed generative UI.",
  "contexts": {
    "blank-page": {
      "tenantId": "GLOBAL",
      "environment": "default",
      "targetApp": "praxis-ui-angular",
      "targetComponentId": "praxis-dynamic-page-builder",
      "currentRoute": "/funcionarios",
      "currentPage": { "widgets": [] },
      "runtimeEvidence": "none",
      "selectedResourceKey": null,
      "selectedComponentId": null,
      "faults": []
    },
    "employee-form": {
      "tenantId": "GLOBAL",
      "environment": "default",
      "targetApp": "praxis-ui-angular",
      "targetComponentId": "praxis-dynamic-page-builder",
      "currentRoute": "/funcionarios",
      "currentPage": {
        "widgets": [
          {
            "key": "employee-form",
            "definition": {
              "id": "praxis-dynamic-form",
              "inputs": { "resourceKey": "human-resources.funcionarios" }
            }
          }
        ]
      },
      "runtimeEvidence": "untrusted_frontend_observation",
      "selectedResourceKey": "human-resources.funcionarios",
      "selectedComponentId": "praxis-dynamic-form",
      "faults": []
    },
    "blank-page-vector-unavailable": {
      "tenantId": "GLOBAL",
      "environment": "default",
      "targetApp": "praxis-ui-angular",
      "targetComponentId": "praxis-dynamic-page-builder",
      "currentRoute": "/funcionarios",
      "currentPage": { "widgets": [] },
      "runtimeEvidence": "none",
      "selectedResourceKey": null,
      "selectedComponentId": null,
      "faults": ["vector-store-unavailable"]
    },
    "blank-page-stale-release": {
      "tenantId": "GLOBAL",
      "environment": "default",
      "targetApp": "praxis-ui-angular",
      "targetComponentId": "praxis-dynamic-page-builder",
      "currentRoute": "/funcionarios",
      "currentPage": { "widgets": [] },
      "runtimeEvidence": "none",
      "selectedResourceKey": null,
      "selectedComponentId": null,
      "faults": ["semantic-release-superseded"]
    },
    "blank-page-cross-scope": {
      "tenantId": "tenant-a",
      "environment": "production",
      "targetApp": "praxis-ui-angular",
      "targetComponentId": "praxis-dynamic-page-builder",
      "currentRoute": "/funcionarios",
      "currentPage": { "widgets": [] },
      "runtimeEvidence": "none",
      "selectedResourceKey": null,
      "selectedComponentId": null,
      "faults": ["only-tenant-b-evidence-available"]
    }
  },
  "cases": [
    {
      "id": "platform-what-can-i-do-pt",
      "family": "platform-capability",
      "status": "must-pass",
      "locale": "pt-BR",
      "contextRef": "blank-page",
      "userPrompt": "O que posso fazer aqui?",
      "expected": {
        "abstractionLevel": "platform",
        "taskMode": "explain",
        "retrievalProfile": "platform",
        "terminalAuthority": "answer",
        "canApply": false,
        "requiredSemanticRefs": ["praxis.platform.capabilities"],
        "allowedResourceKeys": [],
        "allowedComponentIds": [],
        "allowedTools": ["describe_platform_capabilities"],
        "technicalReadBudget": { "maxResources": 0, "maxOpenApiDocuments": 0, "maxSchemas": 0, "maxComponentManifests": 0 },
        "provenance": { "materialSelectionCoverage": 1, "requireCanonicalRelease": true, "requireEvidenceRefs": true },
        "safety": { "forbidUnlistedResources": true, "forbidUnlistedComponents": true, "forbidUnapprovedInference": true, "requireTenantEnvironmentMatch": true, "mutationRequiresPreview": true }
      }
    },
    {
      "id": "enterprise-discover-domains-pt",
      "family": "global-domain",
      "status": "must-pass",
      "locale": "pt-BR",
      "contextRef": "blank-page",
      "userPrompt": "Quais domínios de negócio existem aqui?",
      "expected": {
        "abstractionLevel": "enterprise",
        "taskMode": "discover",
        "retrievalProfile": "global-domain",
        "terminalAuthority": "answer",
        "canApply": false,
        "requiredSemanticRefs": ["enterprise.domain-map"],
        "allowedResourceKeys": [],
        "allowedComponentIds": [],
        "allowedTools": ["discover_domain_map"],
        "technicalReadBudget": { "maxResources": 0, "maxOpenApiDocuments": 0, "maxSchemas": 0, "maxComponentManifests": 0 },
        "provenance": { "materialSelectionCoverage": 1, "requireCanonicalRelease": true, "requireEvidenceRefs": true },
        "safety": { "forbidUnlistedResources": true, "forbidUnlistedComponents": true, "forbidUnapprovedInference": true, "requireTenantEnvironmentMatch": true, "mutationRequiresPreview": true }
      }
    },
    {
      "id": "domain-hr-overview-pt",
      "family": "global-domain",
      "status": "must-pass",
      "locale": "pt-BR",
      "contextRef": "blank-page",
      "userPrompt": "O que o Praxis sabe sobre Recursos Humanos?",
      "expected": {
        "abstractionLevel": "domain",
        "taskMode": "explain",
        "retrievalProfile": "global-domain",
        "terminalAuthority": "answer",
        "canApply": false,
        "requiredSemanticRefs": ["human-resources"],
        "allowedResourceKeys": [],
        "allowedComponentIds": [],
        "allowedTools": ["describe_domain_context", "discover_business_capabilities"],
        "technicalReadBudget": { "maxResources": 0, "maxOpenApiDocuments": 0, "maxSchemas": 0, "maxComponentManifests": 0 },
        "provenance": { "materialSelectionCoverage": 1, "requireCanonicalRelease": true, "requireEvidenceRefs": true },
        "safety": { "forbidUnlistedResources": true, "forbidUnlistedComponents": true, "forbidUnapprovedInference": true, "requireTenantEnvironmentMatch": true, "mutationRequiresPreview": true }
      }
    },
    {
      "id": "surface-explain-employee-form-pt",
      "family": "current-surface",
      "status": "must-pass",
      "locale": "pt-BR",
      "contextRef": "employee-form",
      "userPrompt": "Sobre o que é este formulário e para que ele serve?",
      "expected": {
        "abstractionLevel": "concept",
        "taskMode": "explain",
        "retrievalProfile": "context",
        "terminalAuthority": "answer",
        "canApply": false,
        "requiredSemanticRefs": ["human-resources", "human-resources.employee"],
        "allowedResourceKeys": ["human-resources.funcionarios"],
        "allowedComponentIds": ["praxis-dynamic-form"],
        "allowedTools": ["search_business_concepts", "resolve_domain_bindings"],
        "technicalReadBudget": { "maxResources": 1, "maxOpenApiDocuments": 0, "maxSchemas": 0, "maxComponentManifests": 0 },
        "provenance": { "materialSelectionCoverage": 1, "requireCanonicalRelease": true, "requireEvidenceRefs": true },
        "safety": { "forbidUnlistedResources": true, "forbidUnlistedComponents": true, "forbidUnapprovedInference": true, "requireTenantEnvironmentMatch": true, "mutationRequiresPreview": true }
      }
    },
    {
      "id": "concept-employee-meaning-pt",
      "family": "business-concept",
      "status": "must-pass",
      "locale": "pt-BR",
      "contextRef": "blank-page",
      "userPrompt": "Qual é a diferença entre funcionário e vínculo empregatício?",
      "expected": {
        "abstractionLevel": "concept",
        "taskMode": "explain",
        "retrievalProfile": "context",
        "terminalAuthority": "answer",
        "canApply": false,
        "requiredSemanticRefs": ["human-resources.employee", "human-resources.employment-relationship"],
        "allowedResourceKeys": [],
        "allowedComponentIds": [],
        "allowedTools": ["search_business_concepts", "expand_semantic_neighborhood"],
        "technicalReadBudget": { "maxResources": 0, "maxOpenApiDocuments": 0, "maxSchemas": 0, "maxComponentManifests": 0 },
        "provenance": { "materialSelectionCoverage": 1, "requireCanonicalRelease": true, "requireEvidenceRefs": true },
        "safety": { "forbidUnlistedResources": true, "forbidUnlistedComponents": true, "forbidUnapprovedInference": true, "requireTenantEnvironmentMatch": true, "mutationRequiresPreview": true }
      }
    },
    {
      "id": "concept-cpf-governance-pt",
      "family": "business-concept",
      "status": "must-pass",
      "locale": "pt-BR",
      "contextRef": "employee-form",
      "userPrompt": "O que significa o campo CPF e quais cuidados devemos ter com ele?",
      "expected": {
        "abstractionLevel": "concept",
        "taskMode": "explain",
        "retrievalProfile": "context",
        "terminalAuthority": "answer",
        "canApply": false,
        "requiredSemanticRefs": ["human-resources.employee.tax-identifier"],
        "allowedResourceKeys": ["human-resources.funcionarios"],
        "allowedComponentIds": ["praxis-dynamic-form"],
        "allowedTools": ["search_business_concepts", "expand_semantic_neighborhood"],
        "technicalReadBudget": { "maxResources": 1, "maxOpenApiDocuments": 0, "maxSchemas": 0, "maxComponentManifests": 0 },
        "provenance": { "materialSelectionCoverage": 1, "requireCanonicalRelease": true, "requireEvidenceRefs": true },
        "safety": { "forbidUnlistedResources": true, "forbidUnlistedComponents": true, "forbidUnapprovedInference": true, "requireTenantEnvironmentMatch": true, "mutationRequiresPreview": true }
      }
    },
    {
      "id": "cross-domain-procurement-finance-pt",
      "family": "cross-domain",
      "status": "extended",
      "locale": "pt-BR",
      "contextRef": "blank-page",
      "userPrompt": "Como compras se relaciona com financeiro?",
      "expected": {
        "abstractionLevel": "domain",
        "taskMode": "explain",
        "retrievalProfile": "context",
        "terminalAuthority": "answer",
        "canApply": false,
        "requiredSemanticRefs": ["procurement", "finance"],
        "allowedResourceKeys": [],
        "allowedComponentIds": [],